<root xmlns:xsi="http://www.w3.org/2001/XMLSchema-instance" xmlns="http://www.smltools.org/config"
	xsi:schemaLocation="http://www.smltools.org/config config.xsd">
	<global>
		<params_factory>org.smltools.grepp.config.PredictingParamsHolderFactory</params_factory>
		<spooling>.log</spooling>
		<results_dir>results</results_dir>
		<default_options>-c</default_options>
	</global>
	<options>
		<opt field="VERBOSE" handler="enforceInfo">v</opt>
		<opt field="TRACE" handler="enforceTrace">t</opt>
		<opt field="HELP" handler="printHelp">?</opt>
		<opt field="SPOOLING">s</opt>
		<opt field="FILE_MERGING">m</opt>
		<opt field="USER_ENTRY_PATTERN" handler="setUserLEPattern">L</opt>
		<opt field="PARSE_PROPERTIES" handler="setPropertiesParsing">parse</opt>
		<opt field="ATMTN_LEVEL" handler="setAutomation">c</opt>
		<opt field="ATMTN_LEVEL" handler="setAutomation">a</opt>
		<opt field="ATMTN_LEVEL" handler="setAutomation">f</opt>
		<opt field="ATMTN_LEVEL" handler="setAutomation">e</opt>
		<opt field="DATE_TIME_FILTER" handler="setDateTimeFilter">dtime</opt>
	</options>
	<pp_config default_sep="csv">
		<pp_splitter_types>
			<splitter_type handler="processPostFilter" id="filter" />
			<splitter_type handler="processPostCounter" id="counter" />
			<splitter_type handler="processPostGroup" id="group" />
			<splitter_type handler="processPostAverage" id="avg"
				handler_type="group_method" />
		</pp_splitter_types>
		<pp_separators>
			<separator id="csv" spool=".csv">,</separator>
		</pp_separators>
	</pp_config>
	<automation>
		<level handler="parseCustomConfig" id="entry_pattern" order="1"
			tags="c, e, a" />
		<level handler="parseFilterConfig" id="filter_pattern" order="2"
			fireonce="true" tags="f, a" />
		<level handler="parseExecuteThreadConfig" id="execute_thread"
			order="3" tags="e, a" />
		<level handler="parsePostFilterConfig" id="post_process_pattern"
			order="4" fireonce="true" tags="f, a" />
	</automation>
	<date_time_config>
		<pattern id="INPUT_DATE_TIME_FORMAT" order="1" tags="dtime">yyyy-MM-dd'T'HH:mm:ss</pattern>
		<pattern id="INPUT_DATE_TIME_FORMAT_M" order="2" tags="dtime">yyyy-MM-dd'T'HH:mm</pattern>
		<pattern id="INPUT_DATE_TIME_FORMAT_H" order="3" tags="dtime">yyyy-MM-dd'T'HH</pattern>
		<pattern id="INPUT_DATE_TIME_FORMAT_D" order="4" tags="dtime">yyyy-MM-dd</pattern>
		<pattern id="INPUT_DATE_TIME_FORMAT_m" order="5" tags="dtime">yyyy-MM</pattern>
		<pattern id="INPUT_DATE_TIME_FORMAT_Y" order="6" tags="dtime">yyyy</pattern>
	</date_time_config>
	<custom>
		<config id="properties">
			<starter>log4j.logger</starter>
			<pattern>log4j\.properties</pattern>
		</config>
	</custom>
</root>
